{
  "Version": 1,
  "ID": "f14d3vubmq6xqimope655lrkr2425v6v2qg6byjba",
  "Issue Number": "1",
  "Client": {
    "Name": "Keyko",
    "Region": "Spain",
    "Industry": "Web3 / Crypto",
    "Website": "https://keyko.io",
    "Social Media": "@keyko",
    "Social Media Type": "Twitter",
    "Role": "Dataset Owner"
  },
  "Project": {
    "Project Id": "1",
    "Brief history of your project and organization": "test",
    "Is this project associated with other projects/ecosystem stakeholders?": "Yes",
    "Describe the data being stored onto Filecoin": "test",
    "Where was the data currently stored in this dataset sourced from": "AWS Cloud",
    "How do you plan to prepare the dataset": "test",
    "Please share a sample of the data (a link to a file, an image, a table, etc., are good ways to do this.)": "test",
    "Confirm that this is a public dataset that can be retrieved by anyone on the network (i.e., no specific permissions or access rights are required to view the data)": "[X] I confirm",
    "What is the expected retrieval frequency for this data": "Daily",
    "For how long do you plan to keep this dataset stored on Filecoin": "1.5 to 2 years",
    "In which geographies do you plan on making storage deals": "Asia other than Greater China",
    "How will you be distributing your data to storage providers": "HTTP or FTP server",
    "Please list the provider IDs and location of the storage providers you will be working with. Note that it is a requirement to list a minimum of 5 unique provider IDs, and that your client address will be verified against this list in the future": "test",
    "Can you confirm that you will follow the Fil+ guideline (Data owner should engage at least 4 SPs and no single SP ID should receive >30% of a client's allocated DataCap)": "Yes"
  },
  "Datacap": {
    "Type": "ldn-v3",
    "Data Type": "Slingshot",
    "Total Requested Amount": "2PiB",
    "Single Size Dataset": "512TiB",
    "Replicas": 4,
    "Weekly Allocation": "1TiB"
  },
  "Lifecycle": {
    "State": "ReadyToSign",
    "Validated At": "2024-01-29 12:13:23.667238 UTC",
    "Validated By": "clriesco",
    "Active": true,
    "Updated At": "2024-01-29 12:13:23.667254 UTC",
    "Active Request ID": "a8c3d33d-47ce-4548-8b33-b3da84a0f87b",
    "On Chain Address": "f14d3vubmq6xqimope655lrkr2425v6v2qg6byjba",
    "Multisig Address": "false"
  },
  "Allocation Requests": [
    {
      "ID": "a8c3d33d-47ce-4548-8b33-b3da84a0f87b",
      "Request Type": "First",
      "Created At": "2024-01-29 12:13:23.667264 UTC",
      "Updated At": "2024-01-29 12:13:23.667268 UTC",
      "Active": true,
      "Allocation Amount": "1TiB",
      "Signers": []
    }
  ]
}